{
  "schemaVersion": 1,
  "id": "python3",
  "display_name": "Python 3 (distro)",
  "kind": "system_package",
  "homepage": "https://www.python.org",
  "source_repo": "https://github.com/python/cpython",
  "license": "PSF-2.0",
  "activity": {
    "score": "very-active",
    "scan_cadence_days": 30,
    "scanned_at": "2026-10-26T00:00:00Z"
  },
  "validation_tiers": {
    "tier1": {
      "available": true,
      "notes": "Alpine archive is signed by alpine-keys. Trust is rooted in apk's configuration."
    }
  },
  "system_package": {
    "platforms": {
      "alpine": { "name": "python3" }
    }
  }
}
