{
  "schemaVersion": 1,
  "id": "linux_headers",
  "display_name": "Linux kernel headers",
  "kind": "system_package",
  "homepage": "https://www.kernel.org",
  "source_repo": "https://git.kernel.org/pub/scm/linux/kernel/git/torvalds/linux.git",
  "license": "GPL-2.0-only",
  "activity": {
    "score": "very-active",
    "scan_cadence_days": 30,
    "scanned_at": "2026-10-26T00:00:00Z"
  },
  "validation_tiers": {
    "tier1": {
      "available": true,
      "notes": "Alpine archive is signed by alpine-keys. Trust is rooted in apk's configuration."
    }
  },
  "system_package": {
    "platforms": {
      "alpine": { "name": "linux-headers" }
    }
  }
}
