{
  "schemaVersion": 1,
  "id": "musl_dev",
  "display_name": "musl libc development headers",
  "kind": "system_package",
  "homepage": "https://musl.libc.org",
  "source_repo": "https://git.musl-libc.org/cgit/musl",
  "license": "MIT",
  "activity": {
    "score": "active",
    "scan_cadence_days": 30,
    "scanned_at": "2026-04-29T00:00:00Z"
  },
  "validation_tiers": {
    "tier1": {
      "available": true,
      "notes": "Alpine archive is signed by alpine-keys. Trust is rooted in apk's configuration."
    }
  },
  "alternatives": [
    {
      "tool": "libc_dev",
      "relationship": "similar",
      "scope": "non-alpine",
      "notes": "glibc on Debian/Ubuntu/RHEL. ABI-incompatible with musl; not auto-substitutable."
    }
  ],
  "system_package": {
    "platforms": {
      "alpine": { "name": "musl-dev" }
    }
  }
}
