{
  "activity": {
    "scan_cadence_days": 1,
    "scanned_at": "2026-10-28T21:25:30Z",
    "score": "very-active",
    "signals": {
      "last_release_at": "2026-10-28T00:00:00Z",
      "releases_last_90d": 20
    }
  },
  "available": [
    {
      "version": "18.0.0"
    },
    {
      "version": "18.1.0"
    },
    {
      "version": "18.2.0"
    },
    {
      "version": "18.3.0"
    },
    {
      "version": "18.4.0"
    },
    {
      "version": "18.5.0"
    },
    {
      "version": "18.6.0"
    },
    {
      "version": "18.7.0"
    },
    {
      "version": "18.8.0"
    },
    {
      "version": "18.9.0"
    },
    {
      "version": "18.9.1"
    },
    {
      "version": "18.10.0"
    },
    {
      "version": "18.11.0"
    },
    {
      "version": "18.12.0"
    },
    {
      "version": "18.12.1"
    },
    {
      "version": "18.13.0"
    },
    {
      "version": "18.14.0"
    },
    {
      "version": "18.14.1"
    },
    {
      "version": "18.14.2"
    },
    {
      "version": "18.15.0"
    },
    {
      "version": "18.16.0"
    },
    {
      "version": "18.16.1"
    },
    {
      "version": "18.17.0"
    },
    {
      "version": "18.17.1"
    },
    {
      "version": "18.18.0"
    },
    {
      "version": "18.18.1"
    },
    {
      "version": "18.18.2"
    },
    {
      "version": "18.19.0"
    },
    {
      "version": "18.19.1"
    },
    {
      "version": "18.20.0"
    },
    {
      "version": "18.20.1"
    },
    {
      "version": "18.20.2"
    },
    {
      "version": "18.20.3"
    },
    {
      "version": "18.20.4"
    },
    {
      "version": "18.20.5"
    },
    {
      "version": "18.20.6"
    },
    {
      "version": "18.20.7"
    },
    {
      "version": "18.20.8"
    },
    {
      "version": "19.0.0"
    },
    {
      "version": "19.0.1"
    },
    {
      "version": "19.1.0"
    },
    {
      "version": "19.2.0"
    },
    {
      "version": "19.3.0"
    },
    {
      "version": "19.4.0"
    },
    {
      "version": "19.5.0"
    },
    {
      "version": "19.6.0"
    },
    {
      "version": "19.6.1"
    },
    {
      "version": "19.7.0"
    },
    {
      "version": "19.8.0"
    },
    {
      "version": "19.8.1"
    },
    {
      "version": "19.9.0"
    },
    {
      "version": "20.0.0"
    },
    {
      "version": "20.1.0"
    },
    {
      "version": "20.2.0"
    },
    {
      "version": "20.3.0"
    },
    {
      "version": "20.3.1"
    },
    {
      "version": "20.4.0"
    },
    {
      "version": "20.5.0"
    },
    {
      "version": "20.5.1"
    },
    {
      "version": "20.6.0"
    },
    {
      "version": "20.6.1"
    },
    {
      "version": "20.7.0"
    },
    {
      "version": "20.8.0"
    },
    {
      "version": "20.8.1"
    },
    {
      "version": "20.9.0"
    },
    {
      "version": "20.10.0"
    },
    {
      "version": "20.11.0"
    },
    {
      "version": "20.11.1"
    },
    {
      "version": "20.12.0"
    },
    {
      "version": "20.12.1"
    },
    {
      "version": "20.12.2"
    },
    {
      "version": "20.13.0"
    },
    {
      "version": "20.13.1"
    },
    {
      "version": "20.14.0"
    },
    {
      "version": "20.15.0"
    },
    {
      "version": "20.15.1"
    },
    {
      "version": "20.16.0"
    },
    {
      "version": "20.17.0"
    },
    {
      "version": "20.18.0"
    },
    {
      "version": "20.18.1"
    },
    {
      "version": "20.18.2"
    },
    {
      "version": "20.18.3"
    },
    {
      "version": "20.19.0"
    },
    {
      "version": "20.19.1"
    },
    {
      "version": "20.19.2"
    },
    {
      "version": "20.19.3"
    },
    {
      "version": "20.19.4"
    },
    {
      "version": "20.19.5"
    },
    {
      "version": "20.19.6"
    },
    {
      "version": "20.20.0"
    },
    {
      "version": "20.20.1"
    },
    {
      "version": "20.20.2"
    },
    {
      "version": "21.0.0"
    },
    {
      "version": "21.1.0"
    },
    {
      "version": "21.2.0"
    },
    {
      "version": "21.3.0"
    },
    {
      "version": "21.4.0"
    },
    {
      "version": "21.5.0"
    },
    {
      "version": "21.6.0"
    },
    {
      "version": "21.6.1"
    },
    {
      "version": "21.6.2"
    },
    {
      "version": "21.7.0"
    },
    {
      "version": "21.7.1"
    },
    {
      "version": "21.7.2"
    },
    {
      "version": "21.7.3"
    },
    {
      "version": "22.0.0"
    },
    {
      "version": "22.1.0"
    },
    {
      "version": "22.2.0"
    },
    {
      "version": "22.3.0"
    },
    {
      "version": "22.4.0"
    },
    {
      "version": "22.4.1"
    },
    {
      "version": "22.5.0"
    },
    {
      "version": "22.5.1"
    },
    {
      "version": "22.6.0"
    },
    {
      "version": "22.7.0"
    },
    {
      "version": "22.8.0"
    },
    {
      "version": "22.9.0"
    },
    {
      "version": "22.10.0"
    },
    {
      "version": "22.11.0"
    },
    {
      "version": "22.12.0"
    },
    {
      "version": "22.13.0"
    },
    {
      "version": "22.13.1"
    },
    {
      "version": "22.14.0"
    },
    {
      "version": "22.15.0"
    },
    {
      "version": "22.15.1"
    },
    {
      "version": "22.16.0"
    },
    {
      "version": "22.17.0"
    },
    {
      "version": "22.17.1"
    },
    {
      "version": "22.18.0"
    },
    {
      "version": "22.19.0"
    },
    {
      "version": "22.20.0"
    },
    {
      "version": "22.21.0"
    },
    {
      "version": "22.21.1"
    },
    {
      "version": "22.22.0"
    },
    {
      "version": "22.22.1"
    },
    {
      "version": "22.22.2"
    },
    {
      "version": "22.22.3"
    },
    {
      "version": "22.23.0"
    },
    {
      "version": "22.23.1"
    },
    {
      "version": "22.23.2"
    },
    {
      "version": "22.23.3"
    },
    {
      "version": "22.23.4"
    },
    {
      "version": "23.0.0"
    },
    {
      "version": "23.1.0"
    },
    {
      "version": "23.2.0"
    },
    {
      "version": "23.3.0"
    },
    {
      "version": "23.4.0"
    },
    {
      "version": "23.5.0"
    },
    {
      "version": "23.6.0"
    },
    {
      "version": "23.6.1"
    },
    {
      "version": "23.7.0"
    },
    {
      "version": "23.8.0"
    },
    {
      "version": "23.9.0"
    },
    {
      "version": "23.10.0"
    },
    {
      "version": "23.11.0"
    },
    {
      "version": "23.11.1"
    },
    {
      "version": "24.0.0"
    },
    {
      "version": "24.0.1"
    },
    {
      "version": "24.0.2"
    },
    {
      "version": "24.1.0"
    },
    {
      "version": "24.2.0"
    },
    {
      "version": "24.3.0"
    },
    {
      "version": "24.4.0"
    },
    {
      "version": "24.4.1"
    },
    {
      "version": "24.5.0"
    },
    {
      "version": "24.6.0"
    },
    {
      "version": "24.7.0"
    },
    {
      "version": "24.8.0"
    },
    {
      "version": "24.9.0"
    },
    {
      "version": "24.10.0"
    },
    {
      "version": "24.11.0"
    },
    {
      "version": "24.11.1"
    },
    {
      "version": "24.12.0"
    },
    {
      "version": "24.13.0"
    },
    {
      "version": "24.13.1"
    },
    {
      "version": "24.14.0"
    },
    {
      "version": "24.14.1"
    },
    {
      "version": "24.15.0"
    },
    {
      "version": "24.16.0"
    },
    {
      "version": "24.17.0"
    },
    {
      "version": "24.18.0"
    },
    {
      "version": "24.18.1"
    },
    {
      "version": "24.19.0"
    },
    {
      "version": "24.20.0"
    },
    {
      "version": "24.21.0"
    },
    {
      "version": "24.22.0"
    },
    {
      "version": "24.22.1"
    },
    {
      "version": "24.22.2"
    },
    {
      "version": "25.0.0"
    },
    {
      "version": "25.1.0"
    },
    {
      "version": "25.2.0"
    },
    {
      "version": "25.2.1"
    },
    {
      "version": "25.3.0"
    },
    {
      "version": "25.4.0"
    },
    {
      "version": "25.5.0"
    },
    {
      "version": "25.6.0"
    },
    {
      "version": "25.6.1"
    },
    {
      "version": "25.7.0"
    },
    {
      "version": "25.8.0"
    },
    {
      "version": "25.8.1"
    },
    {
      "version": "25.8.2"
    },
    {
      "version": "25.9.0"
    },
    {
      "version": "26.0.0"
    },
    {
      "version": "26.1.0"
    },
    {
      "version": "26.2.0"
    },
    {
      "version": "26.3.0"
    },
    {
      "version": "26.3.1"
    },
    {
      "version": "26.4.0"
    },
    {
      "version": "26.5.0"
    },
    {
      "version": "26.5.1"
    },
    {
      "version": "26.6.0"
    },
    {
      "version": "26.7.0"
    },
    {
      "version": "26.8.0"
    },
    {
      "version": "26.8.1"
    },
    {
      "version": "26.8.2"
    },
    {
      "version": "26.9.0"
    },
    {
      "version": "26.10.0"
    },
    {
      "version": "26.11.0"
    },
    {
      "version": "26.11.1"
    },
    {
      "version": "26.12.0"
    },
    {
      "version": "26.12.1"
    },
    {
      "version": "26.13.0"
    }
  ],
  "channels": {
    "stable": {
      "default": true,
      "description": "Node.js releases: even-numbered majors become LTS (Active then Maintenance); odd-numbered majors are short-lived Current lines."
    }
  },
  "default_version": "26.13.0",
  "display_name": "Node.js",
  "homepage": "https://nodejs.org",
  "id": "node",
  "kind": "language",
  "license": "MIT",
  "minimum_recommended": "18.0.0",
  "ordering": {},
  "schemaVersion": 1,
  "source_repo": "https://github.com/nodejs/node",
  "validation_tiers": {
    "tier3": {
      "available": true,
      "notes": "Release tarball verified against the publisher SHASUMS256.txt manifest at nodejs.org/dist/v<version>/SHASUMS256.txt, selecting the line for node-v<version>-linux-<x64|arm64>.tar.xz (manifest mode). The manifest is also GPG-signed (SHASUMS256.txt.sig); luggage does not yet verify tier-1 signatures."
    }
  }
}
