{
  "activity": {
    "scan_cadence_days": 1,
    "scanned_at": "2026-10-12T21:41:59Z",
    "score": "very-active",
    "signals": {
      "last_commit_at": "2026-10-12T21:39:35Z",
      "last_release_at": "2026-10-01T12:41:12Z",
      "open_advisories": 6,
      "releases_last_90d": 4
    }
  },
  "available": [
    {
      "version": "1.82.0"
    },
    {
      "version": "1.83.0"
    },
    {
      "version": "1.84.0"
    },
    {
      "version": "1.84.1"
    },
    {
      "version": "1.85.0"
    },
    {
      "version": "1.85.1"
    },
    {
      "version": "1.86.0"
    },
    {
      "version": "1.87.0"
    },
    {
      "version": "1.88.0"
    },
    {
      "version": "1.89.0"
    },
    {
      "version": "1.90.0"
    },
    {
      "version": "1.91.0"
    },
    {
      "version": "1.91.1"
    },
    {
      "version": "1.92.0"
    },
    {
      "version": "1.93.0"
    },
    {
      "version": "1.93.1"
    },
    {
      "version": "1.94.0"
    },
    {
      "version": "1.94.1"
    },
    {
      "version": "1.95.0"
    },
    {
      "version": "1.96.0"
    },
    {
      "version": "1.96.1"
    },
    {
      "version": "1.97.0"
    },
    {
      "version": "1.97.1"
    },
    {
      "version": "1.98.0"
    },
    {
      "version": "1.98.1"
    },
    {
      "version": "1.99.0"
    }
  ],
  "channels": {
    "stable": {
      "default": true,
      "description": "Production-grade releases. New stable cuts roughly every six weeks; patch releases as needed."
    }
  },
  "default_version": "1.95.0",
  "display_name": "Rust",
  "homepage": "https://www.rust-lang.org",
  "id": "rust",
  "kind": "language",
  "license": "MIT OR Apache-2.0",
  "minimum_recommended": "1.93.0",
  "ordering": {},
  "primary_binary": "rustc",
  "schemaVersion": 1,
  "source_repo": "https://github.com/rust-lang/rust",
  "validation_tiers": {
    "tier3": {
      "available": true,
      "notes": "rustup-init verified against publisher SHA256 at static.rust-lang.org/rustup/dist/<triple>/rustup-init.sha256; the rust toolchain itself is then verified by rustup's built-in signed-channel mechanism."
    }
  }
}
