{
  "schemaVersion": 1,
  "id": "libgcc",
  "display_name": "GCC runtime library",
  "kind": "system_package",
  "homepage": "https://gcc.gnu.org",
  "source_repo": "https://gcc.gnu.org/git/gcc.git",
  "license": "GPL-3.0-or-later WITH GCC-exception-3.1",
  "activity": {
    "score": "very-active",
    "scan_cadence_days": 30,
    "scanned_at": "2026-10-26T00:00:00Z"
  },
  "validation_tiers": {
    "tier1": {
      "available": true,
      "notes": "Alpine archive is signed by alpine-keys. Trust is rooted in apk's configuration."
    }
  },
  "system_package": {
    "platforms": {
      "alpine": { "name": "libgcc" }
    }
  }
}
